text,cluster
health care law struck federal judge ruled president obama sweeping healt,22.0
stealth mode making invisible facebook personal finance news yahoo fina,95.0
extreme fishing kayak fishing monster fish bluewater jon bluewaterjon bluewater jon schwartz,60.0
imdb road oscar academy award,88.0
choosing fly fishing gear requires patience start,60.0
king speech win producer guild award three year pga winner win acade,88.0
pure acai berry thorough article pure acai berry buy pure acai berry acai berry extracteveryone se,55.0
republican nimble democrat social medium study find democrat obama cam tcot tlot,45.0
good info fishing team winner,60.0
wonder will fill political vacuum tunesia egypt yemen tunesia egypt yemen,79.0
fatal blast reported moscow airport terminal russian authority monday reported fatal explosion domodedo,36.0
king speech true grit lead oscar race king speech british drama stammering monarch,88.0
horse racing factor bet reliable,94.0
fishing check special closeout item great fly fishing gear buy fishwest check,60.0
lh ainsworth cancer scholarship university south wale australia beasiswa,97.0
watching extreme makeover edition story sad don text drive,104.0
twitition dont text drive remember alex brown,104.0
wait vw beetle great commercial superbowl commercial beetle bug,99.0
session mayo mark people myselfduration pm pmtide started angling fishing,60.0
pocketwatch posted ice fishing shack lake tomahawk,60.0
federal judge florida rule obamacare,22.0
acai berry weight loss diet plan cardiovascular health diet weight loss shedd,55.0
pepsi putting mobile play super bowl advertising marketing branding mobile pepsi superbowl pr,99.0
myl mylan awarded fda approval generic protonix delayed release tablet gerd,58.0
dont text drive worldwide,104.0
gross starbucks trenta cup hold entire bottle wine,62.0
toughens sanction belarus join eu widening sanction belarus leader,110.0
chevy cruze comm fb feed captain america hell carmax comm superbowl commercial,99.0
seriousy gt super bowl food level recipe rock tequila spiked wing luv,87.0
christina aguilera fumble national anthem lyric super bowl tonight super bowl xlv kickoff christina,75.0
kamut international welcome improvement school nutrition bill,102.0
fish recipe cleaning preparation fillet round fish,60.0
favourite commercial superbowl volkswagen commercial force,99.0
wowsa black swan movie intense stirring hope natalie portman win oscar role,101.0
yemeni doubt president won step,79.0
foreign secretary described intimidation harassment journalist unacceptable egypt,66.0
joanna yeates vincent tabak charged murder,86.0
identity theft cost infographic online fraud crime rise mo,108.0
report italian polish medium claim robert kubica injured rally accident italy,11.0
supreme court considers foia protects corporate personal privacy public record law,89.0
doritos didn superbowl commercial dead,99.0
keith olbermann join current tv report keith olbermann controversial liberal pundit ho,30.0
horse wagering legal sport lounge bet zieralski mike merrigan wife lisa oc tave,94.0
strader organ scholarship competition college conservatory music university cincinnati usa university,97.0
watched rite trailer therite,14.0
looter broke museum destroyed pharaonic mummy late friday nation top archaeologist reuters,10.0
flambeau outdoors bazuka pro rod case florida fishing tip wfnewshinged door ea,60.0
health care law struck,22.0
yemen protest february day rage lt lt lt video yemen protest jan ali abdullah saleh news,79.0
weight loss diet plan living healthy acai berry,55.0
giffords surprising doctor hospital icu,37.0
protester hit street yemen,79.0
sag award colin firth best actor natalie portman best actress honor,88.0
city regional service brace storm bracing approaching blizzard ldquo historic proportion rdquo city,57.0
social network king speech aim oscar,88.0
final post series bullying work place business handle bullying,90.0
michelle obama coming atlanta,65.0
catchcatfish posted fishing video bait hook shad gofishn,60.0
outstanding performance female actress natalie portman black swan sagawards,101.0
gonna driving time will text drive,104.0
christina aguilera bungle national anthem three thing singing nationa,75.0
christina aguilera botched national anthem superbowl notice,75.0
rite midnite movie cheesefest video comic,14.0
giffords condition upgraded good cnn,37.0
chicken dumpling,87.0
supreme court refuse hear appeal anti gay,89.0
starbucks trenta size hold entire bottle wine drink,62.0
shame info dissemination bbc confirms service cut,1.0
acai berry chocolate tasting weight loss diet plan demand acai berry eventually lead,55.0
christina aguilera botch national anthem super bowl washington post,75.0
iranian oil tanker escape pirate attack,107.0
rahm emanuel chicago mayor llinois supreme court ruling xmnr chicagomayor rahmemanuel,21.0
dtn uk director guild screen actor guild award picture weekend blur,88.0
vincent tabak charged murder joanna yeates,86.0
fly fishing photo essay canada greatest freshwater adventure explore canada greatest fly fishing adventu,60.0
pa committee approves youth sport concussion bill harrisburg pa whtm state senate education committ,84.0
teamfollowback super bowl commercial doritos don hurt dog dog,99.0
dtn hollywood christina aguilera apologises national anthem flub feedburner share friend,75.0
obamacare ruling injunction bc entire law declared void tcot,22.0
sage advice travel picking bedbug hitchhiker,52.0
sundance day strange celebrity encounter steve carell elijah wood full day sundanc,96.0
arizona immigration law blocked judge,82.0
acai berry weight loss confusing industry analyst acai berry directly re,55.0
checking eww eating lawsuit alleges taco bell beef thisis,20.0
looter destroy mummy egyptian museum,10.0
multiple concussion raise teen athlete health risk health news,84.0
yemen join uprising trend protest start yemen despite concession president yemen jan,79.0
king speech social network locked oscar battle rttnews academy award nomination,88.0
disturbing jesse ewww,25.0
brightnight networking entrepreneur smallbiz owner top influencer nyc,93.0
booker tweet sundance film festival brings brick city park city,96.0
murray mania sweep uk good luck message flood andy murray scottish tennis star play,71.0
hate kim kardashian snookie funny,72.0
missed chrysler riveting imported detroit superbowl ad eminem youtube,99.0
angry bird commercial superbowl afk kill,99.0
photo blair underwood sundance film festival park city utah promoting film homework,96.0
top news giffords full round therapy houston reuters representative gabrielle gifford,37.0
thing rapidly degenerating egypt attack journalist cairo egypt,66.0
pharma news fda clear pgxhealth depressive disorder drug viibryd,58.0
oscar nominee best picture announced morning social network king speech,88.0
prudential whale chevy superbowl commercial,99.0
tsa test privacy enhancing software body scanner privacy,25.0
judge rule obama health care law,22.0
dtn singapore yemen president won stand term sanaa yemeni leader ali abdullah saleh facing,79.0
fishing tackle field stream store hook poking tip barb wine,60.0
reporter including cnn cooper beaten egypt manila bulletin newspaper online,66.0
bryan safi brett erlich sundance bryan safi brett erlich braved cold swiped swag,96.0
mainenance fishing rod preserving rod read,60.0
fast food caught immigration crosshairs los angeles dallas reuters chipotle mexican grill lot going,80.0
chrysler super bowl commercial brilliant case haven,99.0
acai berry nutrient power weight loss diet plan acai berry popularity expanded rain,55.0
fox news,89.0
doctor giffords face rocky road recovery normalcy cnn erwwpr,37.0
jobless rise state worker laid labor department unemployment rate rose,26.0
gossip christina fumble lyric national anthem fail christina agu,75.0
king speech lead academy award nomination including best picture full list nominee,88.0
case needed reason love trenta cup hold entire bottle wine,62.0
australia brace flood,98.0
super cute adzone volkswagen force superbowl ad vader kid think control car,99.0
usa today sport buck forward belief nba concussion protocol,84.0
best lose weight acai berry weight loss diet plan healthy weight reduction,55.0
worst person tonight stop will longer text drive,104.0
diablo chicken chili recipe,87.0
abc breaking terrorist attack moscow airport leaf dead,36.0
king speech win major guild award discus sag award win,88.0
love kardashians,72.0
sm socialmedia revolution social medium uprising epoch time tyranny social medium,45.0
fishing lure bait rig crankbait crankbaits floating lure diving lip bill,60.0
keith olbermann join current tv report keith olbermann controversial liberal pundit ho,30.0
duck security expert warn stuxnet boomerang security,83.0
facebook privacy setting user,95.0
sneak peak superbowl ad lover super bowl ad watch big game,99.0
foreign policy day hunting journalist ashraf khalil,66.0
blog post academy award odds king speech lead oscar nomination oscar,88.0
great advertising vw passat darth vader commercial,99.0
fda approves rituxan maintenance follicular lymphoma chemo,58.0
indian navy capture pirate lakshwadeep island indian navy captured,107.0
apalachicola florida fishing report,60.0
weight loss diet plan acai berry antioxidant popular supplement include antioxidant rich acai berry,55.0
watching superbowl check chrysler commercial omg,99.0
suicide bombing moscow airport moscow suicide bomber killed people russia busiest airpo,36.0
watching rite therite,14.0
fla judge strike obama health care overhaul federal judge declared obama administration health,22.0
celebrity gossip start fly fishing,60.0
dueling protest yemen unfold peacefully thousand pro antigovernment demonstrator held peaceful,79.0
topstories amtrak senator ny nj rail tunnel plan reuters share friend top news,23.0
weight loss diet plan acai juice equal nutritional claim acai,55.0
superbowl kia optimum epic ride big game commercial bimarketing blog comunidade market,99.0
andy murray loses australian open final tennis ausopen,71.0
fda approves drug treat depression,58.0
acai berry weight loss confusing,55.0
tsa test privacy enhancement naked scanner transportation security administration remake,25.0
volkswagen super bowl commercial force,99.0
totally making delicious meal tonight,87.0
commercial liking superbowl pepsi,99.0
obama minute citizen rally president resign egypt,79.0
navy hunt pirate ship,107.0
best commercial superbowl imported detroit chrysler spot,99.0
pm latest chicago free blizzard update flight cancelled storm,57.0
annual trout fishing derby set mckinney park department will host annual trout fishing derby,60.0
guardian uk domodedovo airport hit deadly bombing,36.0
top spinning reel inshore salwater fishing,60.0
taco bell class action lawyer beef battle kfc serf mutant hybrid beast chicken eyeroll,20.0
taco bell sued calling mixture lt beef seasoned beef sound saved lot cow,20.0
percentage rat derived taco bell meat filling meat oat evidently,20.0
android tablet smartphone boost samsung samsung electronics reported fresh time sale high,81.0
greatest walleye fishing trip canada,60.0
cutest vader volkswagen star war commercial air super bowl,99.0
big sport fishing lite android bjd production blog wft newsbig sport fishing,60.0
chelsea handler cozy andre balazs sundance,96.0
dutch break iran link hanging iranelection saudiarabia tunis jan,42.0
chicken cavatelli soup,87.0
james franco best actor nom mobbed sundance film festival,96.0
news cuomo find secret budget flaw albany,19.0
facebook privacy setting user,95.0
minnesota walleye ice fishing good morning walleye fishing north eastern minnesota fishing,60.0
super bowl xlv madness cowboy stadium injury flight delay striking cabby examiner,24.0
photo movie trailer rite trailer video hulu watch stream,14.0
king speech odds oscar glory guardian,88.0
article darkpolitricks federal judge rule health care law darkpolitricks,22.0
check week water fishing forecast,60.0
fish umbra fishhotel aquarium umbra fishhotel award winning modern finned friend mo,60.0
game set match novak djokovic grand slam defend,71.0
facebook instant personalization endangers online privacy consider disabling,95.0
cent sundance work progess,96.0
king sspeech finally win best picture award pga overtake socialnetwork oscar,88.0
chicken wing momofuku octo vinaigrette,87.0
goodness thinking judge rule health care law,22.0
shouldn texted driving snowy foo,104.0
superbowl budweiser product placement favorite commercial,99.0
reading girl guide hunting fishing,60.0
fishin break fishing fish,60.0
headline crain cuomo call albany budget process sham series called permanent douglascastle,19.0
keeping kardashians family love,72.0
diddy star superbowl ad mercedes diddy featured superbowl ad mercedes,99.0
going watch keeping kardashians love,72.0
glenn beck france fox piven york time falsely depicts controversy tcot hhrs teaparty,40.0
vegetarian lawsuit taco bell claiming beef hold actual beef,20.0
lawsuit veracity taco bell meat discourage enjoying colon cancer,20.0
don dangerous drink drive text drive,104.0
post pet care aquarium fish care basic thing beginner review complete guide tropical aquar,60.0
haiti tragedy cement role social medium powerful social tool,45.0
celebrity sighting sundance film festival,96.0
ny gov cuomo slash fund school medicaid,19.0
market today today stock market dow jones industrial average dji nasdaq info,92.0
sundance zooey deschanel rocking miniskirt blazer degree weather,96.0
spinner fishing trout proven system tackle technique strategy catching trout learn,60.0
starbucks trenta cup hold entire bottle wine ounce room spare,62.0
find college scholarship money scholarship institute,97.0
happy friday volkswagen super bowl ad ur fav superbowl ad time,99.0
news photo gallery fly fishing marlboro,60.0
citing option iran reject uranium deal diplomat nytimes,73.0
mario lopez rick foxx dr jackson avery grey sundance,96.0
golf venezuelan president hugo chavez enemy golf venezuelan president hugo chavez,56.0
reaction fla judge ruling health reform law strong florida judge ruling pa health reform,22.0
time start applying college scholarship literally thousand scholarship,97.0
ad watch blogging commercial nyt,99.0
college funding financing help free scholarship money technorati tag college funding college,97.0
fda approves drug prevent premature birth yahoo share friend health smoking sto,58.0
cnn al wrap hu visit cnn jaime florcruz served time magazine long time bureau,61.0
news white stripe broke today,17.0
boardwalk empire king speech top sag award,88.0
doctor giffords recovery sprint day week rep gabrielle giffords recovery fro,37.0
reporter attacked attack journalist send message,66.0
timesxemail chicago warned brace blizzard barrelling chicago emergency official offe,57.0
fishing north coast weather steelhead caught,60.0
fishing live bait,60.0
bbc service cut outlined staff,1.0
murray miss open title,71.0
egypt army secures museum pharaonic treasure report cairo reuters army unit secured egyptian mu,10.0
florida sportsman fishing boating saltwater fly fishing stalking red kayak,60.0
thousand egyptian youth protecting cairo museum sabotage jan egypt mubarak,10.0
aguilera repeat national anthem supposed sing er rampart,75.0
knew national anthem messed lol sang christina aguilera sang,75.0
news pa lawmaker concussion response standard student athlete,84.0
facebook privacy setting user,95.0
post chicago rahm emanuel ballot,21.0
help consolidation consumer debt ehow,74.0
hollywood charlie sheen men team help biggest star,68.0
thi doritos superbowl commerical hot mess,99.0
security news medium fire egypt,66.0
bigger beverage bigger american gottlieb memorial hospital loyola university health system,62.0
cost cent expecting tacobell defends beef secret recipe,20.0
facebook bug allows personal data access phishing repaired washington feb facebook security,95.0
youghal bridge fished ther time year small cod angling fishing,60.0
thousand protest jordan middle east al jazeera english,38.0
volkswagen star war themed commercial superbowl,99.0
guy starbuck cup size trenta hold entire bottle wine,62.0
easy weight loss recipe healthy recipe learn transform favorite food weight,87.0
rip white stripe,17.0
ifwt video christina aguilera mess national anthem superbowl,75.0
east chicken fettuccine recipe chicken recipe cooking,87.0
bbc news iran hang iranian dutch woman sahra bahrami iranelections freeiran,42.0
ventura strike lawsuit tsa truth contagious governor jesse ventura ste,25.0
rahm emanuel stay ballot chicago mayoral election filed news politics president obama ra,21.0
report immigration law enforced consistently ap,82.0
taco bell taco meat filling beef fb,20.0
indy yemen president saleh step yemen president told parliament will seek term,79.0
durbin chair hearing healthcare law hill healthwatch tcot obamacare,22.0
lawmaker question practicality ky immigration bill,82.0
oscar nomination king speech rule nod,88.0
tsa testing advanced imaging technology software select airport,25.0
school tackling cut teen concussion bull ring drill football,84.0
charlie sheen leaf hospital medical emergency,68.0
dtn iran iran executes iranian dutch woman detained poll unrest report iranian dutch woman detaine,42.0
shredded chicken hope guide shredded chicken helpful al,87.0
weight loss diet plan living healthy acai berry,55.0
superbowl force volkswagen commercial stellar mrx,99.0
lt vote budlight commercial thumb superbowl,99.0
wash post tweet cairo bureau chief photographer reportedly arrested egypt,66.0
christina aguilera mangle star spangled banner super bowl abc news sb,75.0
dean baker problem structrual unemployment incompetent manager,26.0
stella artois superbowl commercial youtube ad blitz channel,99.0
healthy skepticism wal mart healthy push michelle obama partnered wal mart,65.0
crash super bowl doritos pepsi max pepsico plan user generated commercial,99.0
news update giffords condition upgraded good doctor rep gabrielle giffords upgraded condition,37.0
sideline test accurately detects athlete concussion minute,84.0
australia greatest olympian ian thorpe expected reportedly comeback international swim,15.0
news alert ruling restores emanuel ballot breaking news alertthe york timestue january,21.0
christina aguilera destroys national anthem superbowl,75.0
supreme court stay okla water fight,89.0
recipe super bowl slider super bowl party food big comfy flavor ease day,87.0
yeahboy nadal australianopen djokovic murray,71.0
black swan drama purest form portman doesn win academy corrupt aronofsky created masterpiece blackswan,101.0
spellbound black swan night budget gross growing natalie amazing hope sweep nomination,101.0
hearing heated sea bass fishing usual fishing year black sea bass specie june,60.0
winter coleslaw chicken salad sandwich kitchen season ross dobson wo,87.0
eye rise fishing field stream,60.0
well surprise good thing healthcare law declared,22.0
best superbowl commercial good game night good ad top superbow,99.0
star kubica involved serious crash yahoo eurosport,11.0
article updated chicken stroganoff recipe,87.0
giffords speaking valve breathing tube,37.0
republic argued florida ruling monday judge roger vinson florida,22.0
charlie sheen rehabs filed charlie sheen nurse,68.0
doritos commercial guy lick cheese guy finger favorite superbowl commercial,99.0
discus fish secret review discus fish secret,60.0
identity theft cost infographic online fraud crime rise mo,108.0
facebook profile harvested setting dating site facebook user unwitting,95.0
white stripe officially call quits,17.0
youtube present shawn moore soul reaching spreading love peace faith hope,99.0
oscar nomination academy award nominee watch,88.0
superbowl pepsi commercial angry girlfriend pretty funny,99.0
potential replacement steve job electronics worked ibm year including senior role,106.0
christina aguilera flub star spangled banner lyric super bowl sport,75.0
federal judge rule health care reform law,22.0
healthy recipe dinner sue healthy lifestyle,87.0
check video bridgestone unexpected obstacle super bowl xlii commercial,99.0
top three super bowl commercial,99.0
invite read cap blog connection join dialogue bullying,90.0
feel super bowl national anthem fail christina aguilera lion den university,75.0
james franco sundance drag,96.0
best buy future proof tech purchase buy program cost complete range con,85.0
rnc chair political vip super bowl republican national committee chairman reince priebus posted,100.0
folk scrambling job don exist find structural unemployment,26.0
artifact stolen egyptian museum cairo sad,10.0
thought dolphin caught pearl hogy rigged oz jig head fish,60.0
superbowl commercial going bud light doritos pepsi,99.0
acai berry chocolate tasting weight loss diet plan demand acai berry eventually lead,55.0
fishing hunting pike year sam biever rice lake caught inch northern pike fis,60.0
orange chicken twist chinese delicious,87.0
watch christina aguilera screw national anthem super bowl,75.0
king speech top film producer award azcentral,88.0
christina aguilera national anthem super bowl flub happen york daily news fox,75.0
facebook great personal careful reveal online privacy security,95.0
black commented chasindatpaper blog post eww eating lawsuit alleges taco bell beef,20.0
check interviewing danny glover houseofswagg sundance thedreamisreal,96.0
james franco wig sundance jared blogging inside decked bing bar,96.0
supreme court doubtful personal privacy false person,89.0
king speech notch top director award bbc news,88.0
losing weight best acai berry benefit report elmerfizz people reduce fat,55.0
hooked ice fishing small sled fishing gear pulling contained fish targeting,60.0
geegood post king speech rule oscar nomination ap,88.0
houston transfer help giffords husband kelly cope,37.0
parmesan chicken broccoli pasta cocktail mom recipe husband love,87.0
college scholarship white picket college tag college financial aid college scholarship money college sch,97.0
lighter note today wrapped second national bed bug summit cue bad joke conference hotel,52.0
maqui berry newest effective losing weight,55.0
judge strike healthcare reform law,22.0
caught lb yellowfin tuna flick fishing flickfishing,60.0
moroccan roasted chicken orange juice recipe recipe moroccan roasted chicken orange,87.0
ice fishing trip frozen connecticut river vic attardo outdoors current strong flow,60.0
terrorist attack view exclusive footage today bombing moscow airport dozen dead tcot ocra,36.0
rep giffords set rehab houston yahoo share friend health smoking story,37.0
iran year nuclear weapon iranelection,73.0
bottega veneta launch fragrance,46.0
acai berry weight loss diet plan healthy weight reduction number diet plan advertised sugge,55.0
update lt gov seek support cuomo budget,19.0
life waste text life shouldn text drive,104.0
glenn beck virulent attack cuny prof fox piven inciting threat aaup irresponsible rhetoric,40.0
watch audi superbowl commercial youtube ad blitz channel,99.0
quora will best buy electronics buy consumer answer,85.0
redfishing great cape fear backwater warmer day light wind,60.0
tomorrow australian open tennis final men andy murray navok djojovic ganna win murray fan murray,71.0
doritos best superbowl commercial lmao,99.0
cuomo budget hit school toddler yonkers longer attend pre school srq,19.0
cuomo call york budget process quot sham quot,19.0
kia commercial advertising superbowl commercial snake consuming,99.0
stock future higher investor refocus economy york reuters stock,92.0
eminem helped plug commercial yesterday superbowl second superbowlxlv,99.0
oscar anounced morning,88.0
ayam goring fried chicken rinse chicken inside cold running water pat dry paper tow,87.0
fast food caught immigration crosshairs,80.0
correcting link yemen latest arab state join unrest activist demonstrating,79.0
going fishing today friend hatteras hope find catch fishing cabo slow,60.0
superbowl commercial elantra psychedelic groupon wrong cocacola cool elantra win,99.0
super bust woe endless texas host super bowl week texas super,24.0
saturday horse racing betting advice,94.0
republican gain democrat social medium,45.0
hack facebook unlocks security facebook adding security feature pair,95.0
fly fishing program host replaces columbia country wft newsbob asbury producer,60.0
imported detroit excellent car commercial paying attention eminen damn superbowl commercial,99.0
menu tonight chicken curry recipe,87.0
watch shearon harris lake jun top water bass fishing,60.0
yemen president facing protest will seek extend term expires,79.0
rite tv spot kingdom,14.0
glenn beck target france fox piven beck scary,40.0
safon oscar nomination list academy award nominee,88.0
recipe fried chicken liver mexico chilies,87.0
ice fishing social medium explosion,60.0
delirious today feeling well time jewish penicillin chicken soup,87.0
okaaaay bowled super bowl well official bud light advert,99.0
news update step checking facebook privacy,95.0
acai berry work reading help understand acai berry work acai berry,55.0
super bowl xlv commercial lm,99.0
fly fishing kunaplaza kunaplaza,60.0
eve fashion week nyc entrepreneur fashion lover networkers join brightnight,93.0
fast food caught immigration crosshairs reuters,80.0
identity theft resource center protecting personal identifying idtheft identitytheft,108.0
karaage japanese fried chicken recipe blog,87.0
barbel fishing float short edited clip barbel day way series top barbel angler mic wo,60.0
fashion week fall fashion week hot list hot list fall fashion week check,93.0
teamfollowback charlie sheen rehab tv hold los angeles reuters half aday,68.0
suu kyi party urge west maintain myanmar sanction reuters,110.0
cozy scene recipe gluten free fried chicken hsoul,87.0
michelle obama coming atlanta washington lady michelle obama planning travel atlanta,65.0
