text,cluster
brain fluid buildup delay giffords rehab,37.0
trailer talk week movie rite mechanic week opportunity,14.0
rnc appoints chairman tampa convention effort visit tampa republican nati tampa fl,100.0
gbagbo camp futile cut ivory coast economy,110.0
chinese president lost translation powerful leader meet expect tran,61.0
england fishing community current management system broken edf,60.0
protest reform start yemen hundred anti government protester gathered sanaa,79.0
stuxnet lead chernobyl russian,83.0
iphone share smartphones phone,81.0
uploaded youtube video nba final lakers celtic game memory highlig,67.0
feed epic sci fi car ad kia optimum super bowl commercial video trendhunter supe,99.0
naughty facebook started sharing personal detail site day turn fb,95.0
super bowl commercial,99.0
bruce will fave kardashian lol,72.0
attack journalist escalate egypt,66.0
keith olbermann join current tv report,30.0
opinion christina sounded amazing super bowl america making big deal,75.0
sundance day strange celebrity encounter steve carell elijah wood full day sundanc,96.0
acai berry supplement weight loss associated content heard oprah win,55.0
finished watching black swan twisted mental strain take embrace role natalie portman incredible,101.0
hot air breaking rahm ballot tcot lt state totally corrupt,21.0
charlie sheen abuse,68.0
music featured motorola xoom super bowl commercial,99.0
rite movie review fan movie deal battle good evil,14.0
potential replacement steve job,106.0
yemen president signal won stay freedomwar egypt jan syria feb,79.0
debt settlement lawyer debt settlement easier lawyer day debt settlement beco,74.0
aguilera repeat national anthem ap ap christina aguilera flubbed belted,75.0
skipped romanian crew journalist threatened attacked detained reporting egypt,66.0
loss weight acai berry capsule benefit,55.0
pew internet online american social networking twitter politics campaign internet,45.0
tbf flw outdooors introduce national high school fishing program national high school fishing program,60.0
fucking awesome jesse jesse ventura slam tsa lawsuit,25.0
king speech awarded best ensemble cast screen actor guild award,88.0
charge fee saltwater fishing license,60.0
bottega veneta teal turquoise knot intrecciato snakeskin clutch,46.0
baked slow cooker chicken crockpotrecipes,87.0
fake snow storm white stripe officially call quits,17.0
chrysler air super bowl commercial,99.0
kid set college time fill fafsa,97.0
funny happened aguilera repeat national anthem yahoo news,75.0
hollywood director honor king speech reuters,88.0
kung pao chicken recipe,87.0
giffords rocky road recovery health news,37.0
complete list super bowl commercial advertiser youtube,99.0
senator avoiding tea party caucus,103.0
watch volkswagen superbowl commercial youtube ad blitz channel escarabaajoos,99.0
washington legislature wade immigration debate oregonlive summary requires employe verify,82.0
te boozing news starbucks huge trenta cup hold entire bottle wine,62.0
carney obama press secretary,44.0
kardashians pier morgan stupid answer question perfect,72.0
chavez mark year office venezuelan president hugo chavez mark year power promising press,56.0
rite safe horror film devil time plain dealer,14.0
chipotle fire hundred immigration raid immigration probe forced mexican chain chipotle fire,80.0
beetle commercial creative superbowl great teaser,99.0
yemen thousand protest government worldnomads travelsafety,79.0
going amazing constitutional showdown reach supreme court,22.0
aquarium fish aquarium success good common sense will fir,60.0
justice extend protection workplace retaliation supreme court ruled employer sued,89.0
white house press secretary jay carney,44.0
oscar reaction guess king speech,88.0
cnn hack facebook unlocks security facebook adding security feature pa,95.0
nfl concussion people survey wix jsquared concussion,84.0
national guard called chicago snow storm woow snow chill people,57.0
loooooooooooove ncis,77.0
weight loss diet plan acai juice equal nutritional claim acai,55.0
traffic depot update oceanside green light red light camera ticket traffic,64.0
christina aguilera mess national anthem start super bowl xlv,75.0
definitely forward superbowl commercial year esp steve martin cameo,99.0
acai berry diet succeed hoodia gordonii site acai berry cultivated acai palm,55.0
hugo chavez apologizes venezuelan people ahead election,56.0
fishing news banner website,60.0
keith olbermann join current tv report keith olbermann controversial liberal pundit ho,30.0
chicago rahm emanuel ballot,21.0
tanning iced coffee tazo iced tea hello trenta,62.0
watching kourtney kim khloe loving waiting forever,72.0
vincent tabak appears court charged murder,86.0
casserole recipe bruschetta chicken bake submitted heather simple creative chicken meal mimic,87.0
honor epic fail national anthem top ten list time worst,75.0
info topic fish tank heater aquarium stuff technorati tag aquarium heater aquariu,60.0
grilled chicken tomato salad,87.0
today read concerned gasland movie stand set record straight,109.0
king speech top film producer award ap ap king speech claimed crown be,88.0
sag prediction award tracker hmmmm,88.0
kia spent lot money optimum superbowl commercial,99.0
doritos commercial raising dead best night superbowl nfl,99.0
idf intelligence chief iran nuclear bomb year haaretz,73.0
yeah don csis nciss enjoy mentalist,77.0
uk robert kubica injured rally accident italian polish medium,11.0
breaking news king speech take top honor hollywood actor honor best sunday night annual screen ac,88.0
obamacare reagan appointed federal district judge florida ruled key portion obama,22.0
st tunisia egypt yemen,79.0
best superbowl commercial year chrysler comeback,99.0
horrible journalist attacked detained egypt yahoo news,66.0
list journalist hurt harassed egypt,66.0
famous facebook flip flop social networking goliath number hasty move year,95.0
yikes list journalist attacked egypt hour abc news,66.0
lady press ahead fitness campaign daily caller obama tell abc good morning america,65.0
judge rule obama health care law,22.0
watch christina aguilera screw national anthem super bowl post,75.0
acai berry powder content health weight loss hard figure,55.0
facebook privacy setting user,95.0
taco bell beef convenience cost,20.0
jordan thousand protest demand pm step wave mass protest arab spread opposition supporter,38.0
yap palau sport fishing promotional sport fishing video produced video rating,60.0
court third party bias protection broad washington jan upi supreme court ruled unanimously,89.0
yell cast jr hartley ad digital era author search fly fishing book dj hunt book read,60.0
boatsshopping fishing headline oklahoma metro trout fishing pond instructional clinic pave exciting winter angling html,60.0
three ton striped bass seized illegal fishing net,60.0
federal judge strike health care reform call insurance purchase mandate aba journal,22.0
love khloe kardashian,72.0
fighter king speech lead nominee tonight sag award beverly hill courier,88.0
check video christina aguilera super bowl national anthem mistake mess err,75.0
murray djokovic happened,71.0
pressure grows myanmar sanction call growing western sanction myanmar,110.0
poll gop catch dems social medium,45.0
nobel war prize wikileaks nuke fired cablegate wikileaks assange anonymous,12.0
bbc news police lose officer,51.0
lololol doritos pepsi max killing superbowl commercial,99.0
federal judge healthcare law,22.0
king speech notch top director award movie running darren aronofsky,88.0
yummy recipe tuesday chicken fricasse,87.0
secret natural weight loss food acai berry benefit,55.0
job wrong place memo president dear president state union add,32.0
employment gaining speed jobless rate,26.0
ten thousand yemeni protest sanaa ten thousand yemeni staged day rage calling,79.0
awful watched don text drive video driving class,104.0
netgear bos astonishing attack steve job,106.0
bronco christina aguilera flub national anthem kmgh denver,75.0
governor proposes sweeping cut funding york school medicaid program slashed,19.0
check article fox news sideline test detect concussion minute,84.0
eye will definetely glued tv screen love kardashians,72.0
don text drive pledge,104.0
fishing technique fishing maine surf fishing striped bass,60.0
tsa unveils body scanner software doesn naked alternet,25.0
oscar king speech haven black swan,88.0
teen creates anti bullying school program,90.0
bedbug rapidly evolving fight pesticide tech news,52.0
super bowl commercial report card ranking winner loser bleacher report,99.0
fast food caught immigration crosshairs reuters,80.0
vice president communication director jay carney named white house press secretary,44.0
high court third party sue retaliation case,89.0
kold aguilera repeat national anthem,75.0
volkswagon commercial superbowl,99.0
deadbedbugs fact bed bug cover,52.0
gross taco bell sued bogus beef,20.0
great bbc piece summarising unrest north africa middle east,79.0
sidney crosby concussion rule change braine hope pray doesn sight,84.0
charlie sheen leaf hospital medical emergency,68.0
trenta cup hold entire bottle wine wrong,62.0
healthy school food pay save attention going,102.0
post financial aid college lt gt financial advice lt gt popular lt gt lt gt,97.0
teacher talking texting driving haaayy,104.0
financial aid help woman school hispanic scholarship,97.0
mubarak silencing voice egypt journalist targeted read jan tahrir,66.0
video favorite superbowl commercial cute,99.0
remember alex brown,104.0
enjoyed vw beetle commercial superbowl favorite,99.0
join campaign texting driving save life future will help,104.0
crazy lake shore drive downtown chicago shut,57.0
blog post potential replacement steve job apple,106.0
acai berry chocolate tasting weight loss diet plan adi news scientifically prov,55.0
red cabbage add color noodle salad soba salad chicken cabbage,87.0
boosting america fashion,91.0
news workshop preventing bullying positive behavior support school,90.0
yemen president won election,79.0
best buy launch electronics buy program ap ap timing shopping gadget,85.0
force strong great ad volkswagon superbowl commercial,99.0
dragon cute drinking cola superbowl cocacola commercial,99.0
latest headline king speech lead oscar field british star colin firth helena bonham carter nominate,88.0
klassy breeze music blog black eyed aguilera love,75.0
journalist social medium report egyptian demonstration journalist,45.0
hooper earns top dga prize king speech hooper won david fincher social network,88.0
ap maker academy award favorite social network king speech competi,88.0
congrats novak djokovic played brilliant tennis definitely deserve title,71.0
breaknews yemen street day rage yemeni filled street sanaa,79.0
protest start yemen despite concession president hundred anti government protest,79.0
al jazeera journalist detained cairo police hotel room equipment confiscated jan,66.0
update michael steele resigns rnc,100.0
egypt yemen demand change government well gt news tcot,79.0
orange student dish school lunch white house chef orlando sentinel fl schoollunch letsmove,102.0
successful ice fishing perch depth finder successful ice,60.0
acai berry weight loss diet plan healthy weight reduction number diet plan,55.0
thought beef lawsuit pr response,20.0
chris hemsworth lead celebrity storm tao sundance ministry appreciates sundance film festival founder,96.0
chipotle face ice inspection state reuters reuters chipotle mexican grill,80.0
love kim kardashian ur hot wooohoooo lol,72.0
ten thousand march yemen president sanaa yemen ten thousand lukewilliamss,79.0
best commercial super bowl imported detroit best,99.0
late night time watch crime solving tv ncis csi sky looooove,77.0
doritos commercial vote funniest superbowl commercial,99.0
budweiser wild west tiny dancer commercial definitely favorite superbowl,99.0
best deal fishing bait lure ebay best price,60.0
fallon follow tip save energy included site tip will help beat hig,27.0
uk foreign office urgently checking briton caught explosion uk news,36.0
government spending cut leave north east forestry commission base saveourforests,51.0
starbucks trenta hold entire bottle wine people cougartown,62.0
interested giffords improves watch hour tv gabrielle giffords watched hour television,37.0
doc river ll wait chris forsberg boston celtic captain paul pierce departed thursday,67.0
facebook privacy setting user,95.0
daily review murdoch ipad newspaper rupert murdoch ipad launch daily offer glitzy graphic,54.0
commercial video eminem lipton brisk super bowl commercial,99.0
updated rehab aim giffords life,37.0
breakingnews looter broke museum destroyed pharaonic mummy late friday nation top archaeologist reuters egypt,10.0
grant fishing smile set grant arizona game fish department ki,60.0
tech cnn hack facebook unlocks security facebook adding security feature,95.0
black swan amazing natalie portman deserves award doubt will,101.0
recipe chicken cutlet,87.0
favorited youtube video gm chevy super bowl commercial bumblebee,99.0
thousand protest jordan middle east,38.0
sundance today tobey maguire demi moore kate bosworth tobey maguire waitin,96.0
extraordinary stuff arrested beaten egypt police,66.0
florida top freshwater fishing destination,60.0
best fly fishing website,60.0
weight loss diet plan living healthy acai berry adi news acai berry promote weight loss imp,55.0
super bowl commercial,99.0
asia center graduate summer grant harvard university usa beasiswa scholarship,97.0
yemen girds day rage saleh vow step bloomberg,79.0
king speech lead academy award nomination including best picture,88.0
freemont tribune safety tip atm tip safety,108.0
man charged joanna yeates murder,86.0
internet news steve job medical problem affect apple stock latest internet news steve job,106.0
gop voter active social networking site political purpose washing artimpactnetpr,45.0
obama campaign playbook promote agenda social medium,45.0
don text drive makeachange,104.0
yemen arrest anti government activist yemen,79.0
king speech win top honor director guild award,88.0
mobile market grew smartphones android driver will drive marke,81.0
fishing report fishnotes caught bass gofishn,60.0
uk news lady take campaign childhood obesity army base,65.0
watch rite free movie online movie online,14.0
fly box folly north american fly fishing forum ongoing effort achieve system perfection,60.0
king speech dominates sag award win best picture osacrs sagawards thekingsspeech,88.0
arizona bid block citizenship illegal immigrant anchor baby tcot tlot,82.0
acai berry diet sexy acai berry scam warning acai berry diet,55.0
lmao didn feistyoldpeople chevy commercial superbowl,99.0
mouratoglou murray djokovic classic yahoo,71.0
endsmeat christina aguilera mess lyric national anthem super bowl,75.0
wilmington nc inshore winter fishing report,60.0
oscar nomination full list academy award nominee,88.0
indicator point great fall steelhead fishing,60.0
yemen protest intensify arrest journalist tawakkol karman,79.0
rash report social medium tool social unrest john rash tunisian mohamed bouazizi cou,45.0
commerce bos immigration reform,82.0
acai berry diet side effect lose weight fast acai berry diet side effe,55.0
great win packer christina land blunder,75.0
celebrity gossip fishing madison river montana,60.0
conan blast christina super bowl anthem blunder time,75.0
identity theft cost create problem business deal reaching fake provider showz,108.0
florida judge strike obamacare america,22.0
king speech rule obvious batch oscar bait news cnews canada,88.0
check price fly fishing lure ebay store info,60.0
debt consolidation help avoid bankruptcy debt consolidation involves single loan,74.0
acai berry acai berry juice weight loss,55.0
daddy prefers vw commercial messing mini darth superbowl dadstalking,99.0
slow news day chicago ll live bloggin mayoral debate cdt,21.0
super bowl commercial coca cola commercial coke,99.0
wished looked lucy hale kourtney kardashian pretty,72.0
reuters celebs hollywood actor honor king speech los angeles reuters oscar front runner king,88.0
best recipe caesar salad caesarsalad,87.0
school tackling cut teen concussion bull ring drill football,84.0
reason acai berry weight loss diet case half popula,55.0
court allows emanuel ballot chicago mayor nytimes tlot news illinois dems,21.0
trout steelhead fly fishing supply stretched canvas poster steelhead trout image,60.0
fatal blast reported moscow airport terminal russian authority monday reported fatal explosion,36.0
simple easy prepare vintage fried chicken recipe,87.0
huffingtonpost sundance film festival james franco three company installation,96.0
australia flooding cost enormous,98.0
win djokovic won australian open,71.0
cnn killed injured terror blast moscow airport terrorist suicide bomber blamed mosco,36.0
fishing bait bait trout fishing trout fishing type equipment dictate,60.0
actress farmiga sundance directing debut reuters reuters vera farmiga big breakout,96.0
dc medium opt tea party tea party caucus remains vigilant teaparty tcot tlot gop dem,103.0
youtube video eminem lipton brisk super bowl commercial,99.0
jordan protester gather country demanding prime minister step al jazeera,38.0
credit card debt consolidation gt credit card studentloans info conso,74.0
sow bug round north american fly fishing forum time march mountain,60.0
meat high quality mediapost beef brouhaha taco bell buzz suffering mediapost,20.0
clinton bugun misir hk nededi secretary clinton condemns attack demonstrator journalist egypt vide jan,66.0
weight loss diet plan south american acai berry currently american lose,55.0
acai berry weight loss diet plan healthy weight reduction,55.0
missouri court rule immigrant adoption right terminated illegally missouri supreme court tuesday ove,82.0
king speech usurps throne oscar leader ap,88.0
coming airport modesty change,25.0
super bowl national anthem singer christina aguilera fail video,75.0
chrysler telling story well check chrysler commercial imported detroit,99.0
top story illinois supreme court rahm emanuel ballot illinois supreme court issued ruling,21.0
weight loss diet acai berry weight loss diet plan diet diet food weight loss beauty sally beauty bea,55.0
entent complete list nomination annual academy award,88.0
hella funnny drt superbowl funniest doritos commercial,99.0
undergraduate scholarship international college hotel management australia beasiswa schola,97.0
hott cold sundance film festival lola blog,96.0
discus fish aquarium,60.0
netherlands recall iran ambassador dutch woman execution foreign policy outrage,42.0
video volkswagen invades super bowl darth vader starwars superbowl,99.0
best buy launch electronics buy program,85.0
workshop offer help student aid form regional workshop open help faf,97.0
drive text,104.0
heard acai berry diet acai berry heard diet purchasing,55.0
continuing cooking winning streak awesome lemon fennel pot roast chicken chicken boring,87.0
red fishing knot book book fishing harry,60.0
wikileaks pushed uk sanction iranian bank cable view britain settin jpost,110.0
king speech wint twee screen actor guild award,88.0
beck rating plummeted,59.0
aaron rodgers helmet saved concussion bear green bay packer qb aaron rodgers believ,84.0
don text drive,104.0
aguilera repeat national anthem,75.0
facebook privacy setting user,95.0
watching superbowl darth vader commercial awesome love dude,99.0
ncis stupidest fucking television,77.0
international scholarship bangor university uk beasiswa scholarship,97.0
fish eat complete fishing guide,60.0
live state massachusetts financial aid college,97.0
bbc yemeni rally president thousand yemeni demonstrating capital sanaa calling president ali abdullah,79.0
applying financial aid groundless myth,97.0
dutch government end official contact iran protest hanging dutch iranian woman al jazeera,42.0
reporting arrest journalist cairo,66.0
rnc money ronald reagan birthday,100.0
charlottesville city school offering student vegetarian option lunch,102.0
prettyman annual fish porn provider coming fly fishing film festival bring subject called,60.0
three journalist tf detained cairo jan mubarak egypt egipto fb,66.0
egypt ripple ally yemeni prez ali abdullah saleh power year won seek term,79.0
eastern sport outdoor harrisburg hunting fishing idea marcus schneck patrio,60.0
don care starbucks trenta cup bigger stomach,62.0
al jazeera report region yemen pres extend term protest call syria,79.0
revolt contagious anti government protest spread yemen tcot tlot jan sidibouzid,79.0
american fishing book guide value,60.0
king speech win big dgas award season tight race social network,88.0
vw black beetle commercial favorite super bowl ad night,99.0
canadian journalist detained harassed foreign journalist targeted cairo,66.0
sidney crosby concussion raise safety debate hockey spark discussion,84.0
omg oprah plege wouldn text drive didn seriously lol xd bbl,104.0
wlcentral yemen day rage february egypt jan yemen feb,79.0
law suit taco bell beef filler find taco bell chihuahua,20.0
chipotle caught immigration crosshairs yahoo news knew genuine mexican working,80.0
love kardashian doll fave doll khloe gt,72.0
elizabeth olsen sundance film festival debut sister footstep theatrical,96.0
screen actor guild award list winner sag king speech reign supreme edie falco,88.0
facebook finally offer http change setting,95.0
competitive fishing tactic fly everyday fisherman thinking man,60.0
creamy recipe fettuccine alfredo chicken recipe,87.0
ice fishing bro brohsdahl jason mitchell byron eckhardt special ice fishing schtick,60.0
flyfishing big earth publishing flyfishing barry reynolds bass walleye buy john,60.0
interview venezuela sweetheart champion chavez venezuelan president hugo chavez speaks meeting,56.0
court emanuel eligible chicago mayor ny time pa habit sur place assez longtemps,21.0
jay carney white house press secretary richard adam guardian,44.0
king speech top screen actor guild award winner mtv movie music,88.0
insurance news federal judge reject health reform law district court judge roger vinson agreed,22.0
attorney general office identity theft prevention tip west virginia attorney general darrell mcgraw,108.0
duraflame log beef taco bell,20.0
superbowl volkswagen commercial force,99.0
hilarious super bowl commercial,99.0
web daily stunning slow day launch daily ipad newspaper ipad,54.0
sundance familiar territory elizabeth bank omg,96.0
hellothere king speech win sag award king speech win best actor trophy sunday bythere,88.0
reporter attacked attack journalist send message,66.0
case haven brilliant motorola xoom ad super bowl,99.0
justin bieber address danger texting driving extreme makeover music celebrity justin bieber,104.0
fda approved injectable drug called makena reduce risk preterm delivery week,58.0
yemeni president ruled decade ll seek extend term pas power son reuters,79.0
brytec fly fishing box brytec fishing,60.0
aquarium fish basic plant container garden pl,60.0
school tackling cut teen concussion,84.0
dont text drive,104.0
thousand jordan protest demand pm step day protest opposition supporter stre,38.0
novak djokovic win australian open well deserved played amazing couldn help feel andy murray,71.0
bad best commercial movie trailer random urge buy doritos bud light superbowl,99.0
type identity theft dark dragon grownup identity theft,108.0
guided fly fishing muskegon river trout,60.0
love khloe alexandra kardashian biggest fan kuwait will meet,72.0
king speech rule obvious batch oscar bait ap,88.0
recap steve job will good time apple,106.0
gt annual academy award nomination announced man ve best picture noms,88.0
today stock market dow jones industrial average dji nasdaq,92.0
doctor giffords face rocky road recovery day week rep gabrielle giffords recovery,37.0
france fox piven defies death threat taunt anchorman glenn beck mental,40.0
reuters top news yemen president won extend term pas son,79.0
oscar nominated gasland director josh fox gas drilling barnett shale dallas observer blog,109.0
full video super bowl national anthem singer christina aguilera fail imalive,75.0
political power social medium foreign affair,45.0
identity theft steal social security number theft,108.0
complete book fly fishing,60.0
college best financial aid arizona state university,97.0
spreading thousand protest jordan demand pm step aljazeera net,38.0
manchester austerity cut hit frontline service leisure centre library swimming pool public toile,51.0
thing social medium revolution,45.0
best buy launch electronics buy program ap,85.0
social network king speech aim oscar ap ap academy award voter poised set showd,88.0
ticker thousand yemeni call president quit,79.0
australian open final novak djokovic andy murray live blog bleacher report contributor scott,71.0
yemen republican guard dispatched roaming street sana reliable source,79.0
cbc ticker southeast australia brace flood australia deadly flood crisis forced people,98.0
fda approves pharma preterm birth drug embattled drugmaker pharmaceutical reported health reg,58.0
acai berry weight loss confusing helen arsenault january talk mogul op,55.0
update fly fishing tip beginner ultimate guide learn fly fish pro,60.0
ufo paranormal terrorist bombing moscow airport,36.0
hawaii won release obama birth info,41.0
horse racing oc tavern bar state offer track horse betting,94.0
starbucks size trente hold entire bottle wine enjoy,62.0
super bowl recipe todd dirt dirt man shared recipe patch ve ta,87.0
spicy food popular child quick thai style chicken soup will hit,87.0
crystal clear kim kardashian single fucking idiot,72.0
drug rehab work charlie sheen reportedly receiving help clearest benefit pat,68.0
social network king speech aim oscar ap ap academy award voter poised set,88.0
real acai berry supplement deal rapid fast weight loss well ordered acai berry blast,55.0
watching extreme makeover don text drive,104.0
