text,cluster
sundance time catch celebrity sighting glimpse going sundance festival,96.0
superbowl commercial winner vw vader xoom heard price bridgestone beaver,99.0
dtn hollywood king speech dominates oscar nomination feedburner share friend ente,88.0
white stripe officially call quits,17.0
geez hide taco bell beef,20.0
christina aguilera fumble national anthem christina aguilera flubbed belted nat,75.0
health care litigation insurance mandate,22.0
kardashian family,72.0
problem doritos commercial punchline start superbowl,99.0
kubicas injury major setback renaults assault title year petrov reserve driver will struggle pt,11.0
colorado river colorado fly fishing condition report kynd,60.0
doritos commercial super bowl banned sexy ban,99.0
tennis murray set djokovic final andy murray battle reach australian open men single,71.0
changing facebook place privacy setting roll facebook place location glo,95.0
offbeat idea eliminate credit card debt month offbeat idea eliminate credit card,74.0
time superbowl start time start planning wing recipe great wing recipe,87.0
greatest super bowl commercial bridgestone reply youtubeadblitz superbowl sb,99.0
seth godin news texting working shouldn text driving talk cell phone argu,104.0
giffords condition upgraded good,37.0
breaking news jo murder accused remanded,86.0
indian navy sink mother ship somali pirate arabian sea held fifteen pirate custody,107.0
cnn jesse ventura slam tsa lawsuit count jesse ventura flier don junk touched,25.0
acai berry weight loss diet plan healthy weight reduction number diet plan,55.0
anti government protest spilling yemen business,79.0
watched extreme makeover edition awsome lt,104.0
debt consolidation augment debt problem finance money,74.0
obama name press secretary,44.0
don text drive remember alex brown,104.0
amtrak senator ny nj rail tunnel plan york reuters amtrak announced plan monday,23.0
vooov starbucks trenta cup hold entire bottle wine,62.0
worldchanging yemen president facing protest will seek extend term expires,79.0
laying horse betfair route,94.0
don agree hines ward nfl concussion hypocrisy,84.0
pledge text drive,104.0
doritos super bowl commercial funny second going overboard,99.0
best buy launch electronics buy program,85.0
watch video learn protect privacy identity personal safety facebook profile,95.0
interesting community fishing derby feature angler ice lt lt,60.0
hosting live chat concussion cdcheadsup rehearsed emergency plan chat,84.0
dtn hollywood charlie sheen troubled timeline charlie sheen trouble pretty alw,68.0
acai berry diet linda acai berry diet acai berry weightcrushers ambria dealcenter,55.0
judge rule health care law,22.0
aljazeera thousand protest jordan,38.0
thousand march yemen president middle east independent,79.0
superbowl commercial top number gt force volkswagen,99.0
bbc news king speech lead oscar field,88.0
thrilled colin firth won best actor sag award well king speech best ensemble woo hoo,88.0
journalist attacked cairo journalist covering scene ground target,66.0
random concept explicit acai berry weight full excitement,55.0
acai berry effective weight loss pill current health article tafdropdn blue acai berry effective,55.0
egyptian army start rounding journalist,66.0
fda approves premature birth drug philadelphia inquirer share friend top news health,58.0
truth chalupa ain beef alabama law firm claim lawsuit taco bell false adv,20.0
domino working well yemen call emergency meeting ahead protest cnn,79.0
best way save energy live energy efficient save mo,27.0
biebs switch body jon stewart,63.0
mastering big chill outdoors fishing news ice fishing kind,60.0
king speech lead oscar nomination fact wrong king speech impresse,88.0
pepsi promotes domestic violence crime superbowl ad,99.0
suicide bomber kill russia biggest airport,36.0
loved ad chrysler eminem super bowl commercial imported detroit,99.0
treasure coast fishing report jan trout action good river angler sight cast,60.0
djokovic thrash murray win australian open,71.0
job wrong place memo president dear president state union ad,32.0
reminder beware identity theft harm credit tip protect identity,108.0
dozen killed moscow airport suicide bombing noticias,36.0
nice check video chrysler eminem super bowl commercial imported detroit,99.0
link superbowl ad motorola xoom tablet parody apple ad release feb,99.0
supermarket diet easy recipe quick healthy meal good lose weight delicious easy coo,87.0
change security setting facebook protect account international business time,95.0
blemish org ten thousand turn rival rally yemen los angeles time reuterstens thousand turn,79.0
television network cbs write episode half men include charlie sheen,68.0
chavez mark year office venezuelan president hugo chavez mark year power promising news,56.0
youtube video brisk eminem super bowl commercial,99.0
whitneyport king speech tom hooper reign supreme director guild award,88.0
watch coca cola superbowl commercial youtube ad blitz channel,99.0
simple tip holding white koi fish pond,60.0
sign text drive,104.0
super bowl xlv christina aguilera repeat national anthem espn,75.0
motorola post earnings android,81.0
governor cuomo budget proposal eliminates funding healthy family york,19.0
financial aid proper method financial aid education applying financial aid financial aid essay,97.0
king speech boardwalk empire score sag award big weekend king speech director,88.0
watching blue blood cbs,77.0
south korea negotiating delivery somali breaking news south korea negotiating delivery,107.0
mercedes benz super bowl commercial,99.0
ap source obama pick biden spokesman white house press secretary,44.0
pepsi max people laughing commercial kind laugh american idol audition superbowl,99.0
amazing gah sad cry eye text drive watching will,104.0
star head sundance,96.0
malaysia hold somali pirate saving ship,107.0
teepeecreek ten thousand march yemen president ap teepeecreek,79.0
colorado nation scammed state denver coloradan receive scam invitation,108.0
king speech true grit lead oscar nomination,88.0
best weight loss pill acai berry advantage king bop loved appreciated solely lucky en,55.0
sedative free whale fishing researcher tactic save endangered whale tangled,60.0
chicken taquitos recipe epicurious,87.0
perez hilton christina aguilera mess lyric national anthem super bowl ooop hitechcj,75.0
kia optimum epic ride super bowl commercial nfl fanhouse,99.0
spending cut toy library jeopardy,51.0
christina aguilera mangle national anthem super bowl xlv superbowlxlv fb,75.0
kardashians suicide bomb fuck outta shit hate entire internet,72.0
star head sundance,96.0
will egypt facebook powered revolution hard heel tunisian protest,45.0
sunday episode kktny crazy,72.0
politics governor cuomo budget seek reverse sham york reuters york governor,19.0
el talent king speech cast honored santa barbara international film,88.0
joanna yeates murder accused vincent tabak remanded custody vincent tabak man accused murdering,86.0
opinion taco bell suit expose ignorance meat shortly news taco bell lawsuit ou,20.0
energy money office saving,27.0
chicken brick mark bittman simple delicious recipe mark bittman ny time column,87.0
thought sbux couldn fantastic starbucks huge trenta cup hold entire bottle wine,62.0
acacia berry diet acacia berry acai weight loss hcg diet plan happened account parti,55.0
regular folk united responds ruling obamacare tcot mdreps hcr aacons bookerrising,22.0
beaumont quartet scholarship beaumont high girl signed letter intent college,97.0
perfect super bowl chili,87.0
aggressive tackling learn lasting damage concussion teen,84.0
gasland nominated academy award coga defends,109.0
black swan good movie melodramatic natalie portman phenominal shoe best actress,101.0
supreme court nasa intrusive background check,89.0
aguilera fluff super bowl anthem,75.0
mynews oscar nomination king speech real contender king speech brit mynews,88.0
mob democracy facebook twitter youtube revolution politics daily,45.0
mt committee protect journalist rpts st journo die covering egypt jan,66.0
child safety fredericksburg three key preventing bully encounter,90.0
shoutout lmao kim kardashian real live slut,72.0
told thin ready burn fat,55.0
told trim fat ready check burn fat,55.0
nominate shorty award food love food ve eating mcds year yea,78.0
white stripe breakup ain,17.0
mike iaconelli bass fishing ike hook big bass difficult situation video ratin,60.0
cabo san lucas cabo san lucas fishing report january early don plan making dinner,60.0
briton dead moscow blast british citizen people killed bomb attack moscow,36.0
standing bully employee leading example excellent article,90.0
excess best omg starbucks huge trenta sized drink hold entire bottle wine,62.0
watching yemen,79.0
court put emanuel chicago mayor race,21.0
rite movie clip,14.0
copy obama birth certificate bill pass xmnr tcot gop,41.0
american wine glass hairpin starbucks trenta cup hold entire bottle wine,62.0
facebook privacy setting user,95.0
liberty group back cuomo budget suffolk county project fiscal reform chance tcot nygop,19.0
state budget school risk toddler yonkers longer attend pre school,19.0
countdown rahmageddon,21.0
global warming update bizarre weather destroyed crop whale,29.0
rite movie review horror movie claiming inspired true event including amityville horror,14.0
nytimes federal judge rule health law violates news breakingnews,22.0
colorado nation scammed state identity theft protection expert warn informatio,108.0
sideline test detect concussion minute foxnews,84.0
king speech win best film gong king speech win best film accolade producer guild ameri,88.0
kate bosworth happy sundance day,96.0
donald rumsfeld reflects writing memoir rumsfeld began thinking book unknown,16.0
chicken vegetable herb brown rice,87.0
special chicken stew recipe chicken recipe stew recipe jamie oliver recipe love oliver bright star,87.0
heard christina aguilera flubbed superbowl national anthem night,75.0
superbowl audi commercial,99.0
hatteras jack fishing report rodanthe monday january nailed striper,60.0
credit card debt consolidation debt settlement option credit card debt consolidation debt sett,74.0
thin link burn fat,55.0
volkswagen present best super bowl commercial going second version brill,99.0
great breaking rahm emanuel ballot supreme court rule,21.0
hindu killed suicide bomber strike moscow airport,36.0
indian navy seizes pirate indian ocean mothership don care tnfisherman,107.0
knew soy taco law firm sue taco bell claim beef label misleading,20.0
gov andrew cuomo drop budget axe,19.0
best photo day sundance swag edition eminem chuck dueces best pic,96.0
amazon acai berry weight loss expectation acai berry amazon named super fruit cl,55.0
post tsa unveils generic body scan usa today big si fascism tsa,25.0
christina aguilera wrong lyric usa national anthem superbowl,75.0
judge rule health law law mandatory insurance hcr ppaca aca,22.0
employment gaining speed jobless rate washington reuters employment shifted higher,26.0
king speech boardwalk empire score sag award big weekend king spe,88.0
time journalist obama press secretary news,44.0
hey dont text drive sake ur life sake love yall,104.0
financial aid pry money cold stingy finger financial aid office appeal fafsa finan,97.0
brain fluid buildup delay giffords rehab rep gabrielle giffords transferred houston brain,37.0
il supreme court imposed stay political execution rahm emanuel ballot,21.0
rahm stay chi mayoral ballot dbl standard city residency rule public worker nytimes,21.0
well lunch lawsuit taco bell claim meat mixture beef,20.0
red light camera save life budget star ledger editorial board star ledger file photored ligh,64.0
recipe roast chicken warm lemon herb potato salad recipe day,87.0
winning large stock market winning large stock market individual trading stock,92.0
fishing exclusive popular sporting wft newssimple sharp sp,60.0
penn badgley snowboarding sundance penn badgley snowboard burton snowboard park city mountai,96.0
blog post tunkwa leighton lake ice fishing report,60.0
yesterday brilliant deserves oscar gold hooper top dga prize king speech abc,88.0
breaking news oprah winfrey reveals secret sister filed oprah winfrey,13.0
twitter tweet perennial plant january bloomnflower recipe recipe,87.0
suu kyi party urge west maintain myanmar sanction reuters reuters party myanmar pro,110.0
youtube video chevrolet camaro superbowl commercial al chevrolet hd,99.0
bbc news domodedovo airport blast rock moscow main airport breakingnews moscow,36.0
swift debt relief valuable tip debt consolidation consider,74.0
watched pugattack hilarious superbowl commercial check vote attack,99.0
doritos son funny as superbowl commercial wack,99.0
egypt crack foreign journalist guardian jan,66.0
youtube mercedes benz super bowl commercial,99.0
facebook privacy setting user,95.0
bigger boat albert pujols biggest fish catch cardinal chum reel,60.0
starbucks trenta hold entire bottle wine,62.0
interesting deep sea fishing knowing tide outdoors,60.0
yemen call emergency meeting ahead protest yemen president ali abdullah saleh called emergen,79.0
acai berry product real wait loss brand question fezangee acai berry pro,55.0
tmz sez james franco sundance drag filed james franco hitechcj,96.0
obama campaign playbook promote agenda social medium,45.0
best commercial hold closer tiny dancer budlight superbowl,99.0
john orr award university edinburgh uk beasiswa scholarship,97.0
ohhh kardashians will fav stupid,72.0
oscar king speech true grit lead nomination examiner,88.0
health care law obama administration vowing move full speed ahead implementa,22.0
protect laptop theft,108.0
judge ruling health reform law radical judicial activism amok overturned medi,22.0
oscar nomination king speech earns nod true grit,88.0
happy friday volkswagen super bowl ad ur fav superbowl ad time,99.0
screen actor guild award nomination full list peer review academy award ch,88.0
watch sony ericsson superbowl commercial youtube ad blitz channel,99.0
catch best buy buyback extended cut full info,85.0
king rsquo speech oscar nod daily beast,88.0
imported detroit best commercial superbowl chrysler,99.0
crowley expands scholarship program nicaragua exemplary student awarded scholarship,97.0
super bowl recipe gumbo fried chicken grilled salmon ciabatta patch top notch recipe,87.0
keeping wit kardashians mystery hollywood dead,72.0
reading court rahm emanuel eligible chicago mayor nytimes illinois supreme court,21.0
explosion rock domodedovo moscow busiest airport injured,36.0
tech hack facebook unlocks security facebook adding security feature pair,95.0
don text drive remember,104.0
recognized supreme court harmful organic sector organic,89.0
tackle buy fishing fishing,60.0
caught criminal mind finally work castle watch time watch ncis true love,77.0
sky news charlie sheen enters rehab hospital well,68.0
fly fishing largemouth bass tip manual fly fishing largemouth bass tip lisa gove break st,60.0
cuomo cut spending budget plan,19.0
lady army health initiative model fitness nutrition usa today,65.0
reporter egypt broad assault,66.0
supreme court put rahm emanuel ballot,21.0
multiple concussion raise teen athlete health risk medline,84.0
apple disclose succession plan ceo steve job influential proxy advisory firm i report,106.0
countdown rahmageddon illinois supreme court voted unanimously rahm emanuel,21.0
deadly red light camera return va,64.0
read open letter michael steele chairman republican national committee rnc tcot,100.0
cutest superbowl commercial darth vader,99.0
wine problem solved starbucks trenta cup hold entire bottle wine,62.0
keith olbermann join current tv report,30.0
st augustine travel guide florida fishing licence online travel florida usa tour tourism news vacation tip,60.0
somali pirate killed south korea rescue freighter crew south korean commando secure boat,107.0
open golf djokovic murray australian open title cbc,71.0
data privacy day roundup add ons tool tip protect online,108.0
usa hockey considering proposal increase safety,84.0
looter smashed egypt national museum damaged priceless artifact picture,10.0
acai berry chocolate tasting weight loss diet plan adi news scientifically prov,55.0
reel report bass bite best thing going absence fishing graphic today good,60.0
foot snow hour chicago latest blizzard warning don travel stay indoors chicago breaking news,57.0
harry potter ftw complete list annual academy award nomination oscar,88.0
steven wright year fishing salvador dali dotted caught fish,60.0
motorola xoom superbowl ad reference,99.0
doritos creep best commercial superbowl,99.0
meet jay carney guy white house press secretary,44.0
popular superbowl commercial superbowl view feb fb share tweet,99.0
georgia hb immigration reform bill creates staggering cost taxpayer tweak existing law,82.0
channel cat north american fly fishing forum dual purpose thread figure post,60.0
global cio apple face mounting pressure steve job succession plan,106.0
catch fish banjo minnow,60.0
chat director star rite anthony hopkins english grandfather,14.0
spending budget gov cuomo unveils today will include substantial cut hundred,19.0
identity theft cost infographic,108.0
texting driving don mom,104.0
christina aguilera mess star spangled banner super bowl dumb bitch,75.0
pressure grows myanmar sanction afp,110.0
watch bud light superbowl commercial youtube ad blitz channel,99.0
murray play final pressure,71.0
acai berry juice drinking weight loss juice will help,55.0
nightt twitterlandd remember text wait shawty lt,104.0
good fishing tip finding fish,60.0
stock climb merger deal stock boost onslaught corporate merger market open monday,92.0
guardian journalist arrested beaten alongside protester egypt secretly record ordeal,66.0
cairo building adjacent egypt national museum priceless collection pheoronic art entirely fire,10.0
giffords surprising doctor hospital icu exercise wounded rep gabrielle giffords,37.0
bringing tear message heart don text drive,104.0
shredded bbq chicken slider creamy cole slaw recipe,87.0
ancho chicken tortilla soup ancho chicken tortilla soup feel good favorite cozy meal,87.0
best super bowl commercial year bridgestone beaver,99.0
justin bieber jon stewart exchange role mtv news quote day,63.0
read spending hvagents info,19.0
southwest fly fishing magazine,60.0
yell cast jr hartley ad digital era author search fly fishing book dj,60.0
news growing anti regime protest spread yemen,79.0
gov cuomo budget propsal slash nyc york city facing billion hit result,19.0
race santa anita friday horse betting money race santa anita park friday janu,94.0
academic merit scholarship melbourne institute business technology indonesia beasiswa,97.0
facebook privacy setting user,95.0
taco bell fight beef lawsuit taco bell launching advertising campaign today fight,20.0
chicken rice melange recipe chicken recipe cooking,87.0
mnh photo sundance film festival,96.0
texting working shouldn text driving talk cell phone argue dog,104.0
bass pro shop rapala pro bass fishing rod peripheral rapala pro bass fishing rod peripheral list,60.0
wild sport fishing sailfish mutton grouper shark wild sport fishing,60.0
yemen president ali abdullah saleh quit,79.0
reading learn well knew dont text drive time donttextdrive,104.0
wisconsin detector law family duplex,49.0
waiting tasteless violent pepsi tribute ronald reagan commercial superbowl,99.0
salty bacon creamy avocado succulent chicken classic delicious salad,87.0
oscar nomination nolan snubbed king speech roll washington post,88.0
imdb firth portman king speech triumph sag award,88.0
news fishing derby today lake neshonoc west salem friend lake neshonoc ice day fishing der,60.0
cpj egypt instigates medium blackout police target journalist,66.0
love finding stuff acai berry juice drinking weight loss lookin sally,55.0
thousand yemeni call president quit thousand yemeni demonstrated capital thursday,79.0
acai berry supplement help weight loss bamadems reason acai ambria dealcenter,55.0
doesn kim kardashian,72.0
bud light good start superbowl,99.0
health acai berry effective colon cleanse ingredient acai berry rightly desc,55.0
michael johnston colorado legislator state tuition illegal immigrant proposed necn,82.0
splc report examines motivation effect anti immigrant law local state level immigration,82.0
case missed christina aguilera butchered national anthem,75.0
identity theft cost infographic online fraud crime rise mo,108.0
potential replacement steve job tech idea steve job absent app,106.0
teen told wont text drive donor yeah sad reading photo caption choked,104.0
apple account percent smartphone market profit,81.0
energy conservation tip south hill electric heating cooling,27.0
ventura strike lawsuit tsa iavian,25.0
bishop exorcist praise exorcism movie catholic culture washington postbishop exorcist praise exorci,14.0
going text driving,104.0
kardashian love yu sooooo,72.0
christina aguilera mess national anthem super bowl,75.0
florida car accident attorney texting ban state road safer,104.0
postdoctoral fellowship cancer duke university usa beasiswa scholarship,97.0
fishing spot small fish soft bait,60.0
king speech oscar nomination ridiculous state union isn till tonight,88.0
ffing football watching commercial st half doritos bridgestone faves superbowl,99.0
cuomo budget reading quick takeaway doesn recommend closing,19.0
djokovic win second set leading stage murray mum shell shocked,71.0
christina aguilera defends fumbling national anthem super bowl,75.0
press release nocsae urge parent athlete fact concussion football,84.0
venezuela chavez enemy golf,56.0
inproductive minute brilliant volkswagen commercial aired superbowl trekkie,99.0
volkswagen darth vader commercial good bet super bowl wager,99.0
commercial going sunday super bowl favorite word beetle superbowl,99.0
post celebrity news chelsea handler recount sundance weekend kendra wilkinson hugh hefner,96.0
thousand rally government yemen breaking,79.0
abc news compiled list journalist threatened attacked detained egypt,66.0
winning scholarship college third edition in college scholarship auction ebay,97.0
blog post oscar nomination nominee announced king speech nomination,88.0
nytimessports oversight group vow pursue update football helmet standard,84.0
georgia official praise judge ruling health care law fight,22.0
audi dream superbowl commercial,99.0
judge obama health overhaul ap,22.0
oscar nomination king speech well worth euro afternoon,88.0
facebook adding full http support website secure user fb,95.0
investor advisory firm call apple disclose ceo succession plan concern health apple chief,106.0
decide win hyper masculine super bowl audience doritos super bowl ad,99.0
toyota texas bass classic continue support texas park wildlife department athens toyota texas,60.0
thing social medium revolution enticing idea,45.0
reason federal judge individual mandate health care overhaul declared void obamacare,22.0
best buy buy program don upgrade major electronic equipment,85.0
justin bieber roseanne barr super bowl ad wacky bunch superbowl commercial,99.0
venti trenta starbuck ounce supersize offer crazy fb,62.0
annual ice fishing extravaganza draw hundred annual jig ice fishing extravaganza held wee,60.0
learning recipe doesn cream potato soup cream chicken soup,87.0
battle exorcism movie rite exorcism hmmm read find care weigh,14.0
hey surplus population lawsuit taco bell claim meat mixture beef,20.0
good app called auto text reply will auto text office car angel pledge don text drive,104.0
starbucks cup hold entire bottle wine,62.0
gallon fish tank rutherfordton gallon fish tank bought year didnt long month,60.0
fast food caught immigration crosshairs los angeles dallas reuters chipotle mexican grill lot,80.0
favorite superbowl ad pepsi max,99.0
don text drive hey easily turn goodbye,104.0
facebook privacy setting user,95.0
undergraduate scholarship university ontario institute technology uoit canada beasiswa,97.0
hurriyet turkish center help workplace bullying victim return job market,90.0
christina aguilera messed national anthem super bowl xlv dep,75.0
proper fishing tackle catch fish dream,60.0
summit obama praised china reducing tension korea china deal nk shelling,61.0
identity theft cost infographic,108.0
audi luxury prison break super bowl commercial,99.0
taco bell beef meat qualify taco filling yikes,20.0
yemen pres salih will seek term step egypt pres mubarak,79.0
testing track student recovery sport concussion milford daily news,84.0
journalist beaten threatened egypt,66.0
assessing cuomo effort cut york medicaid budget,19.0
texting driving pledge ive close wresting median interstate,104.0
chicken parm classic comfort food katie lee share recipe add garlic bread good measure anyon,87.0
wonder young man pant tsa,25.0
scary cyclone yasi compare latest news queensland flood news au,98.0
youtube chili pepsi max super bowl commercial pepsi max super bowl commercial jamaal al din nfl,99.0
glenn beck post biggest rating drop cable news january fb,59.0
michelle obama coming atlanta lady discus childhood obesity atl,65.0
facebook privacy setting user,95.0
celebrity butchering national anthem digg christina aguilera flawlessly sung national anthem,75.0
judge toss health care reform law federal judge ruled president obama sweep cnn,22.0
seth godin texting working shouldn text driving talk cell phone argue wit,104.0
fave kardashian phillyblack fuckin hate khloe kardashian,72.0
food burn belly fat don,55.0
fish casting bubble bet find,60.0
guru guide super bowl commercial favorite watch,99.0
james franco suzanne summer will nom tmrw,96.0
official ny cuomo proposing painful budget cut sdut,19.0
pug dorrito commercial best,99.0
trend spring,46.0
decision amount dressing circuit,89.0
antonin scalia save individual mandate,22.0
worth daughter loved chrysler commercial watched time hulu save detroit,99.0
facebook privacy breakthrough,95.0
