text,cluster
google news budget plan spread pain albany time union reutersbudget plan spread painalbany time unionmajor,19.0
dumb as skechers commercial wack as kimkardashian superbowl worst,99.0
fox news correspondent beaten hospitalized fleeing molotov cocktail egypt video treated spy military,66.0
thousand protest jordan reform cnn news,38.0
blackberry beating iphone smartphone battle,81.0
ditto pepsi max commercial win lmao superbowl,99.0
exclusive charlie sheen doesn rehab charlie sheen refusing enter reh,68.0
texting driving good idea,104.0
mba scholarship nottingham university business school uk beasiswa scholarship,97.0
dtn news judge strike part health care law federal judge ruled presiden,22.0
super bowl xlv christina aguilera repeat national anthem espn,75.0
acai berry effective weight loss health benefit article will explain aca,55.0
news sen paul tea party hold power hill predicted tea party movement,103.0
super bowl recipe buffalo chicken pizza,87.0
breaking al jazeera journalist arrested cairo egypt crowd grows tahrir,66.0
chevy run deep chevrolet commercial superbowl ad check imabuzzagent,99.0
christina aguilera fluff national anthem,75.0
npr fda approves drug prevent preterm birth,58.0
andreawoo talked chrysler superbowl commercial,99.0
facebook instant personalization privacy setting sharing innermost secret,95.0
oscar nomination draw attention pa gas drilling gasland fracking,109.0
identity theft cost infographic online fraud crime rise mo,108.0
federal judge florida strike obama health care plan south florida,22.0
stuxnet concern iranian health ministry york time published report week describing stuxnet,83.0
eliza dushku drop sundance adorable ll admit thing eliza dushku,96.0
blog post beefy,20.0
volkswagen commercial force superbowl toocute,99.0
lizzie olsen storm sundance film festival kevin dolak buzz worthy film premiering week,96.0
exsteme makeover grabbing heart don text drive,104.0
king speech land nomination award season favorite social network trail true grit,88.0
will facebook privacy seriously site import facebook profile permission cnn,95.0
china praise hu trip fruitful yahoo news,61.0
unique college scholarship student,97.0
watch australian open men tennis final live online will history andy murray,71.0
superbowl commercial kale fitblog,99.0
charlie sheen leaf hospital medical emergency,68.0
french journalist arrested cairo,66.0
super bowl xlv christina aguilera repeat national anthem,75.0
journalist attacked detained egypt big hollywood,66.0
obamacare struck stage set showdown federal judge monday struck,22.0
fishing rule federal panel table kevin wadlow annual harvest popular recreational fish,60.0
best super bowl commercial commercial super bowl cream advertisi,99.0
sedative free whale fishing,60.0
yemen protest february day rage video news egypt jan mubarak syria libya jordan ugc,79.0
list journalist threatened attacked detained reporting egypt,66.0
egyptian army start rounding journalist jpost,66.0
twitter facebook blocked egypt news jan politics sm jan,45.0
airhead christina aguilera screw national anthem super bowl xlv tcot tlot,75.0
missouri court rule immigrant adoption right terminated illegally missouri supreme court tuesday overtu,82.0
photo star sundance hollywood contingent set shop mid,96.0
taco bell sued selling fake meat damn wonder fake lmao eating taco bell month ago haha,20.0
jmg court rule rahm emanuel ineligible mayor chicago opponent white house,21.0
toyota renews scholarship program donation american indian college fund denver jan prnewswi,97.0
cnn anti government protest yemen hundred anti government protester gathered news,79.0
quick avgolemono orzo chicken soup recipe,87.0
favorite superbowl commercial vw,99.0
andy murray australian open final will face djokovic atptennis yeg,71.0
academy award nominee,88.0
south korea target pirate incorporation anti piracy operation gulf aden op,107.0
social network king speech aim oscar,88.0
swanson vitamin review weight review acai berry buy calorie control weight swanson vitam,55.0
novak australian open champion,71.0
sending prayer marquis daniel boston celtic pray going okxo,67.0
acai berry eating regimen review lose lb rapid zwak org info acai berry benefit yo,55.0
crappie fishing wild fish recipe fishing tip minnesota fishing news wi,60.0
chevy volt commercial prolly best simple tell great story nicely brandbowl superbowl,99.0
don text drive,104.0
storm sign global warming mama believing,29.0
thousand protest jordan reform,38.0
amazing guardian journalist record audio arrest transport egypt police van jan,66.0
fed crack bedbug,52.0
protest sanaa yemen feb,79.0
nobel peace prize wikileaks,12.0
mbah moute nba concussion protocol usa today share friend sport basketball nba,84.0
popular fly fishing smallmouth bass auction,60.0
vincent tabak man accused jo yeates murder deeply saddened death,86.0
queensland flood blog arrived brisbane january surprised green,98.0
holy ball bloody omg novak djokovic australian open,71.0
fda ok viibryd treat depression fda approved drug called viibryd treat adult major depressiv,58.0
watch chrysler superbowl commercial youtube ad blitz channel,99.0
parent student educator tip preventing bullying ten district school organized event,90.0
rp cooking update italian recipe food cooking recipe,87.0
national hockey league concussion rise sidney crosby marc ap sport staff associated pressp,84.0
announcement lyon township high school host free college financial planning seminar feb patch,97.0
southeast australia set week flood,98.0
trout fishing tip learn wedding preparation trout fishing tip help catch bigger,60.0
lady focus military family childhood nutrition overstatement chi,65.0
greg biffle justin bieber address danger texting driving extreme makeover mtv,104.0
debt settlement program ftc law debt settlement better article learn,74.0
haha christina aguilera spelled bad sing fucked national anthem super bowl lol,75.0
journalist egypt brutally silenced equipment confiscated freedom press,66.0
waiting kktn tonight love kardashians,72.0
chipotle mexican grill received immigration custom enforcement notice inspection restaurant,80.0
minute court ruling allows rahm emanuel atlantic wire,21.0
latest news jesse ventura force tsa submission jennifer abel thing pr guardian usa,25.0
list academy award nomination chicago sun time,88.0
justin bieber jon stewart body snatching victim video,63.0
christina aguilera flub national anthem singing er rampart watched gallant,75.0
engel today egyptian unrest continues journalist targeted egypt jan,66.0
gear salmon fishing,60.0
lose weight world effective nutrition acai weight loss acai berry weight loss,55.0
natalie portman colin firth king speech winner sag melissa teo christian bale,88.0
save energy cash quick easy tip article will help save ton money saving en,27.0
bioportfolio news fda approves drug reduce preterm delivery risk pharmaceutical busi bioportfolio news,58.0
climate change update bizarre weather destroyed crop legendary fund manager jeremy grantham weig,29.0
bully sense anxiety relaxation technique,90.0
alert best buy announces buy program electronics news alert,85.0
thing social medium revolution activist twitter,45.0
king speech dominates oscar nomination,88.0
full list oscar nominee,88.0
favorite superbowl commercial doritos snicker darth vader volkswagen commercial pretty funny,99.0
changing facebook place privacy setting opportunity business location based mobile marketin,95.0
egyptian army start rounding journalist egyptian military rounded journalist thursday,66.0
cuomo expose dirty budget trick cut announced today,19.0
black swan trippy natalie portman good performance,101.0
watch christina agulilera botch national anthem super bowl michael mccarthy usa today heard,75.0
cal grant financial aid application california student launched student maximize aid option app,97.0
future iran nuclear talk ahmadinejad afp afp iran president mahmoud ahmadinejad,73.0
oscar nomination box office help king speech soar tuesday dilemma box,88.0
chrysler commercial eminem best bad car terrible superbowl,99.0
carp secret homemade fish bait recipe catch bigger carp pole bending time tested fish bait,60.0
news video white stripe call quits read breakup rip bummer,17.0
couldn place tsa unveils modest body scanner abc news,25.0
today president alisaleh yemen vowed election support peaceful transition power feb,79.0
eminem super bowl commercial damn chrysler commercial imported detroit,99.0
egypt turn internet long broadcast violence strongarms journalist leave,66.0
olbermann land current grow york adage outspoken tv host keith olbermann fresh,30.0
acai berry scam free trial weight loss genius scam associated acai berry supposed,55.0
lmao check funny commercial doritos pepsi max,99.0
identity theft cost infographic,108.0
yemen day rage draw ten thousand,79.0
legal news study red light camera save life nwindiana,64.0
king speech top directing prize,88.0
tunisia egypt yemen,79.0
recognizes reduced state spending key solving ny fiscal crisis,19.0
usa national anthem hard song sing,75.0
chevy volt super bowl commercial discovery sb sbxlv,99.0
white stripe officially broke thought record devastated,17.0
catalan tv team foreign journalist detained military police cairo,66.0
pirate battle free norwegian ship,107.0
briton killed moscow blast uk foreign office report british citizen,36.0
glenn beck fran piven michael tomasky comment free americafirst,40.0
facebook privacy setting user facebook privacy setting extremely detailed,95.0
discus fish aquarium,60.0
superbowl pepsi commercial best,99.0
king speech lead oscar race nomination nominee annual academy award,88.0
navy destroys pirate mother ship arrest pirate indian navy coast guard joint operatio,107.0
latest dallas super bowl fiasco seat north texas rough week super bowl host,24.0
charlie sheen abuse,68.0
industry boo oscar nod gasland,109.0
american fishing wire duo lock snap size lb sizescorrosion resistant black finish,60.0
footballer destroying kid brain game,84.0
journalist attacked detained egypt rtdna condemns assault,66.0
florida immigration law focused employer hasn enforced politics ap miamiherald,82.0
president yemen ali abdullah saleh will seek extend presidential term pas power son jan yemen feb,79.0
lfc king speech nominated oscar bad considering game,88.0
ih industry news chipotle scrutiny ice,80.0
justin bieber extreme makeover fan kid teen warning text drive inspired touched,104.0
robert redford open anniversary sundance film festival protest planned,96.0
judge entire hc law piper,22.0
saltwater fish tank harmful human help,60.0
packer win super bowl christina aguilera national anthem wrong news sky xy,75.0
pak thousand yemeni demand govt change thousand yemeni street capital sanaa inspir,79.0
facebook privacy setting nicholas jackson facebook privacy option,95.0
don text drive example cell phone driving backseat,104.0
novak djokovic champion australian open,71.0
checkout fishing fishinggear deal save,60.0
uk news neighbour remanded jo yeates murder,86.0
tracyjones college student file fafsa fafsa government eligibility,97.0
hahaha doritoes commercial best superbowl,99.0
neighbour remanded jo yeates murder,86.0
watching keeping kardashins lol,72.0
hashtags tv ad superbowl audi launch commercial twitter hashtag,99.0
gas industry doesn gasland oscar nod figure fracking marcellus,109.0
illinois supreme court rahm emanuel ballot illinois supreme court issued ruling allowing rahm,21.0
dont text drive,104.0
eric sharp hot spot ice fishing eric sharp detroit free press eric sharp wisp smelt vi,60.0
pensacola salt water fishing guide undoubtedly best tourist destination map unite,60.0
australian open men final andy murray novak djokovic,71.0
mann texting driving,104.0
dutch freeze contact iran hanging iranelection well late,42.0
viibryd approved treat depression adult psych central news,58.0
lady army health initiative model fitness nutrition mimi hall usa today time,65.0
pepsi max ad pepsi refresh message superbowl commercial,99.0
crispy chicken drumstick ranch dressing recipe,87.0
don fda approved ingredient list taco bell beef,20.0
joined totally loving khloe kardashian,72.0
carpetbagger will oscar friend nomination academy award will academy award oscar,88.0
thefighter best ensemble film king speech will win best picture oscar,88.0
today talker aguilera botch star spangled banner clip survey colt,75.0
whatproblem charlie sheen enter rehab cbs halt production hit series,68.0
list journalist attacked egypt,66.0
hooper boost oscar chance dga win king speech tom hooper won director movie,88.0
commercial winning audi time luxury prison pepsi max dieting wife husband superbowl,99.0
king speech star santa barbara international film festival santa barbar artimpactnetpr,88.0
kia optimum commercial dumbest,99.0
christina aguilera fluff american national anthem super bowl xlv,75.0
christina aguilera forgets national anthem super bowl,75.0
day ago driving started text thought,104.0
gabrielle giffords good condition transfer rehab,37.0
best fishing spot lm clickrealstyle,60.0
buy acai berry cicerone superiority lfittips,55.0
house kill arizona style immigration bill rep rick rand house pas ari,82.0
read goldman sachs manipulated red light photo industry geico ticket higher insurance rate,64.0
twitter explodes christina aguilera mess national anthem super bowl,75.0
newsshare yemen president won extend term pas son reuters,79.0
china half import tax consumer electronics president hu news china will halve,61.0
trout fishing duo slated lmfa longview news journal local event trou,60.0
rp cooking update chicken vegetable stir fry recipe readyseteat food recipe cook,87.0
sign pledge abc makeachange,104.0
weight loss acai berry diet improvement acai berry diet individual large amount accept,55.0
trial pirate suspected hijacking south korean freighter samho jewelry arabian sea,107.0
beth yarrow memorial award medical science university south wale australia beasi,97.0
obama care,22.0
journalist harassed attacked detained cairo nigh cnn ben wedema,66.0
professor ken albala wrote op taco bell meat,20.0
anti government protest start yemen,79.0
alarabiya crew attacked pro mubarak protester cairo egypt,66.0
taco bell lawsuit claim chain beef meat,20.0
oscar nominee,88.0
michelle obama atlanta move campaign,65.0
big news chicago rahm emanuel eligible chicago mayor court,21.0
topix super bowl football gree jpg christina aguilera flubbed belted,75.0
pew republican democrat social medium,45.0
supreme court issue landmark decision constitution void,89.0
bomber kill russia biggest airport,36.0
acai berry weight loss diet plan healthy weight reduction,55.0
man tased mpd fight fishing tourney jan year cable wisconsin man,60.0
today jan judge declares obamacare total thought,22.0
gamble care egyptian museum artifact freedom people egypt,10.0
assistance offered student aid form,97.0
super bowl commercial,99.0
study red light camera save life,64.0
perfect super bowl party food bbq chicken pouch post,87.0
fave st half commercial doritos grandpa superbowl,99.0
king speech boardwalk empire nab sag award king speech continued reign hbo prohibiti,88.0
doritos super bowl commercial offensive video dorito,99.0
supreme court pass poultry case,89.0
dreamed men ship game ausopen murray djokovic great showdown,71.0
best worst super bowl commercial,99.0
remembering alex brown,104.0
textin driving remember alex brown teamfresh,104.0
ten thousand march yemen president ap news,79.0
djokovic british hope fading usual sorus murray,71.0
australian disaster linked global warming,29.0
egyptian uprising play social medium site despite government internet restriction egypt,45.0
kardashian love mami,72.0
lady obama call move fitness nutrition campaign national,65.0
illinois court emanuel stay chicago ballot chicago reuters white house chief st news,21.0
fly fishing,60.0
stein report gt south dakota bill target illegal immigration,82.0
tennis star hoping third time lucky scottish tennis star andy murray set break duck grand,71.0
steve job health private matter joe wilcox betanewssadly reaffirm position stated du,106.0
doritos commercial clear doritos work superbowl,99.0
faster forward news corp launch tablet daily app ipad designed scratch dail,54.0
foxchicago blizzard trap driver lsd hour,57.0
white stripe broke feel inevitable duo remarried gonna work commonsense,17.0
thousand rally government yemen,79.0
anton yelchin choked felicity jones mtv sundance celebrity photo booth,96.0
physically congratulate pepsi woman physically harmed making commercial brandbowl superbowl,99.0
justin influence text drive,104.0
vital sign helmet guard aaron rodgers,84.0
great info college financial aid time apply,97.0
carney picked obama press secretary mike allen politico,44.0
npr news ill high court emanuel chicago mayor,21.0
suicide bombing moscow airport kill,36.0
kayak fishing extreme sport wavewalk fishing kayak angler kayak fishing extreme sport,60.0
king speech lead oscar nomination nomination,88.0
judge strike healthcare reform law unjust law unjust men gandhi,22.0
extremely good analysis difficult will murdoch money daily blog,54.0
birthers hawaii bill charge president obama birth record effort silence birthers,41.0
doritos funnyass commercial superbowl pug ftw,99.0
budlight commercial superbowl fingerscrossed,99.0
amazes taco bell lawsuit usda call beef taco percent beef meat realfood,20.0
fishnewseu issf urge limit tuna fishing capacity international seafood sustainabili eu tweet daily,60.0
dead moscow airport explosion,36.0
defglam christina aguilera apologizes screwing national anthem,75.0
breaking news federal court rule obamacare afternoon federal judge florida ruled,22.0
al jazeera protestors create human shield egyptian museum protect egypt egipto jan,10.0
long awaited era djokovic australianopen replay,71.0
fda approves drug reduce risk premature birth time,58.0
watching rite therite,14.0
online american social networking twitter republican catch democrat social,45.0
guardian music birmingham city council cut bcmg reversed protest kicking fuss work,51.0
ice fishing iowa,60.0
personal loan debt consolidation,74.0
stealth mode making invisible facebook personal finance news yahoo fina,95.0
acai berry weight loss diet plan healthy weight reduction,55.0
kia optimum epic ride big game commercial,99.0
glenn beck france fox piven york time falsely depicts controversy tcot,40.0
post christina aguileras national anthem apology slammed taylor hick christina aguileras nation,75.0
haha arod fed doritos commercial superbowl,99.0
kristin kreuk sundance stroll rachael leigh cook kristin kreuk rachael leigh cook greet crowd,96.0
sundance film festival celebrity sighting,96.0
journalist social medium report egyptian demonstration audioboo,45.0
interested fly fishing guide prague,60.0
homerun ohio chrysler superbowl commercial struck chord detroiters,99.0
drive text include tweeting,104.0
firth portman bale leo win screen actor prize ap king speech won best actor trophy sunday,88.0
facebook privacy setting user,95.0
state union small business key winning future small business fu,32.0
family ice fishing clinic derby idaho fishing idaho,60.0
oscar nod best picture torn king speech inception,88.0
charity slam asbo replacement plan tackle anti social behaviour will repla,90.0
dead moscow airport explosion explosion attributed russia investigative committee cnn,36.0
catch catfish hand,60.0
stock market daily stock market analysis january nse asi retreat,92.0
nyfall fashion week feb ny fashion week fall will feb,93.0
pro mubarak rioter chase reporter cairo hotel beaten threatened beheading,66.0
texan driver promise text drive lt,104.0
cost australia flooding enormous news atlanta nyc,98.0
budweiser spamming crappy commercial superbowl beer suck drink micros quit die,99.0
belarus promise adequate response eu sanction belarus voiced readiness proportionate,110.0
stealth mode making invisible facebook personal finance news yahoo fina,95.0
risk taker mike cairo january afp egypt police arrest al jazeera english journalist channel,66.0
moviefone intrview makingof interview sundance filed celebrity interview video sundance film fe,96.0
facebook twitter revolution mediapost searchblog overview internet blackout af,45.0
jesse ventura wrestling star governor true american hero,25.0
general fishing newscoarse fish today meeting ifi aci angling ireland,60.0
eminem eminem lipton commercial super bowl bsckids,99.0
blogfeed court don boot rahm will stay ballot ruling,21.0
chicago city sneer snow brought chicago reuters chicago city sn,57.0
oprah winfrey family secret prompt buzz timesherald,13.0
lt will text drive,104.0
youtube video bud light hack job superbowl commercial,99.0
patagonia fishing kayak beach hat size tag nr kayak wft newspatagonia fishing ka,60.0
france fox piven defies death threat taunt anchorman glenn beck link lit,40.0
obama economy priority generate job unemployment rate pe,26.0
protecting financial info identity theft mail,108.0
maclife best buy selling verizon iphone starting february verizon customer pic,85.0
anti government rally hit yemen,79.0
multiple concussion raise teen athlete health risk yahoo,84.0
colin firth natalie portman best actor actress thinking king speech social network,88.0
wisconsin fishing report posted,60.0
bed bug deadbedbugs help fact bed bug treatment,52.0
river monster breede saltwater fishing general fishing fish,60.0
army protestors protect imperiled cairo museum,10.0
credit card debt bankruptcy alternative legally settle bad credit card debt great economic crisis,74.0
cook trout fresh water fish grilling fish heart healthy recipe cook trout,60.0
protest start yemen despite concession president cnn,79.0
james franco wear blonde wig sundance,96.0
aguilera repeat national anthem,75.0
avon somerset police charged vincent tabak murder jo yeates hope life ruined,86.0
somali pirate face life sentence lee hyo sik somali pirate captured south korean special,107.0
acai berry cena austin meyer acai berry weight loss acai berry thin acai berry thin ra acai berry thin frum,55.0
well korean navy rescue hijacked crew kill pirate,107.0
sanction dull tehran commercial image casual observer sanction irania,110.0
jay carney voice relationship will develop jaycarney,44.0
acai year weight loss diet plan acai berry purplish fruit harvested palm tree,55.0
doritos commercial dog best,99.0
king speech oscar nomination beverly hill calif british monarchy saga king speech,88.0
mama texting drive damn raining,104.0
network anchor leave egypta amid crackdown increased violence intimidation directed journalist,66.0
deadly suicide bombing hit moscow airport people killed injured suicide bomb blast mo,36.0
yemeni president won seek term,79.0
court rule rahm emanuel ineligible chicago mayoral race law il chicago rahm,21.0
king speech honored santa barbara fest ap,88.0
supreme court fiancee complaining worker protected retaliation,89.0
full sag award movie winner,88.0
poll gop catch dems social medium younger internet user pew,45.0
saving house heating cooling,27.0
paul rudd jesse peretz bushy beard sundance comedy idiot brother paulrudd jesseperetz sundance,96.0
hugochavez venezuelan commemorate democracy day january rebelleft,56.0
weight loss diet plan living healthy acai berry,55.0
yikes egyptian army start rounding journalist,66.0
rep giffords fitness level bodes well recovery add diet loaded fruit,37.0
check delicious chicken recipe,87.0
sag award winner list king speech fighter boardwalk empire rack trophy mawu,88.0
aurobindo pharma receives usfda approval levofloxacin tablet news,58.0
keith olbermann current tv hosting chief news officer,30.0
sign pledge text drive,104.0
facebook privacy setting jour,95.0
doritos wit homo commercial time wit dat la superbowl,99.0
christina aguilera screw national anthem,75.0
court third party sue retaliation case,89.0
mte time cpj journalist targeted egypt,66.0
france fox piven defies death threat taunt anchorman glenn beck,40.0
king speech won top prize weekend hollywood actor director securing standing,88.0
gasland oscar nod draw industry ire gasland documentary detail environmental impact process called fra,109.0
unemployment rise state fall ap ap unemployment rate rose hawaii alohatone,26.0
southern oregon fly fishing club,60.0
lower credit card debt,74.0
christina aguilera screw national anthem super bowl xlv judge,75.0
watching rite,14.0
fishing warm weather fish cold front litening fish feed read fishingreports,60.0
weight loss diet plan living healthy acai berry people sticking,55.0
firth portman bale leo win screen actor prize king speech won best actor trophy sunday col,88.0
weight loss diet plan living healthy acai berry adi news acai berry promote weight loss imp,55.0
tsa body scanner outline private part,25.0
starbucks trenta size hold entire bottle wine god bless america,62.0
michelle obama coming atlanta bob keefe washington lady michelle obama planning travel,65.0
ki medium journalist egypt targeted beaten detained mubarak support,66.0
wind blowing east amazing fishing nearby island gonna plan trip catch barracuda,60.0
appropriate apple shareholder demanding steve job succession plan macabre tone,106.0
test case malaysia selva somali pirate captured international water malay,107.0
ncis bomb love,77.0
hu jintao visit fails thaw chinese relation north korea,61.0
novak won australian open champion gotta beat champion,71.0
avani news gop senator seek change born citizen usa today,82.0
fantastic news gt king speech lead oscar field nomination,88.0
poseidon kia commercial awesome superbowl,99.0
doritos commercial redemption superbowl,99.0
christina fail ulera ear bleed time hear sing fucking national anthem forshame,75.0
power social medium,45.0
poll gop catch dems social medium younger internet user pew social medium,45.0
fishing find freshwater fishing lure cheap ebay buy,60.0
king speech top directing prize,88.0
